{
  "version": "0.42.0",
  "license": {
    "name": "MIT",
    "details": "The MIT License"
  },
  "interfaces": [
    "TZIP-16",
    "TZIP-12"
  ],
  "views": [
    {
      "name": "view0",
      "implementations": [
        {
          "code": []
        },
        {
          "specification-uri": "https://example.com/v1.json",
          "path": "/get-something"
        }
      ]
    },
    {
      "name": "view-01",
      "implementations": [
        {
          "parameter": {
            "prim": "pair",
            "args": [
              {
                "prim": "mutez",
                "annots": [
                  "%amount"
                ]
              },
              {
                "prim": "string",
                "annots": [
                  "%name"
                ]
              }
            ]
          },
          "return-type": {
            "prim": "map",
            "args": [
              {
                "prim": "string"
              },
              {
                "prim": "string"
              }
            ]
          },
          "code": [
            {
              "prim": "DUP"
            },
            {
              "prim": "DIP",
              "args": [
                [
                  {
                    "prim": "CDR"
                  },
                  {
                    "prim": "PUSH",
                    "args": [
                      {
                        "prim": "string"
                      },
                      {
                        "string": "Huh"
                      }
                    ]
                  },
                  {
                    "prim": "FAILWITH"
                  }
                ]
              ]
            }
          ],
          "annotations": [
            {
              "name": "%amount",
              "description": "The amount which should mean something in context. It's in `mutez` which should also mean something more than lorem ipsum dolor whatever …"
            },
            {
              "name": "%name",
              "description": "The name of the thing being queried."
            }
          ],
          "version": "PsCARTHAGazKbHtnKfLzQg3kms52kSRpgnDY982a9oYsSXRLQEb"
        }
      ]
    }
  ]
}
